{
    "name": "schema",
    "description": "Example schema for Ouija Balatro Seed filter config",
    "author": "pifreak",
    "keywords": [
        "CHAD",
        "PERK",
        "YEET"
    ],
    "filter_config": {
        "numNeeds": 2,
        "numWants": 12,
        "Needs": [
            {
                "type": "SmallBlindTag",
                "value": "NegativeTag",
                "Antes": [2,3,4,5,6,7,8]
            },
            {
                "type": "BigBlindTag",
                "value": "NegativeTag",
                "Antes": [3,4,5,6,7]
            },
            {
                "type": "Joker",
                "value": "HangingChad",
                "edition": "None",
                "stickers": [],
                "Antes": [1,2]
            },
            {
                "type": "SoulJoker",
                "value": "Perkeo",
                "edition": "None",
                "Antes": [2,3,4]
            }
        ],
        "Wants": [
            {
                "type": "Joker",
                "value": "HangingChad",
                "edition": "Negative",
                "jokerstickers": [
                    "Perishable",
                    "Rental"
                ],
                "Antes": [1,2,3,4,5,6]
            },
            {
                "type": "Joker",
                "value": "HangingChad",
                "edition": "Negative",
                "jokerstickers": [
                    "Eternal"
                ],
                "Antes": [1,2,3,4,5,6]
            },
            {
                "type": "Joker",
                "value": "HangingChad",
                "edition": "Negative",
                "jokerstickers": [],
                "Antes": [1,2,3,4,5,6]
            },
            {
                "type": "TarotCard",
                "value": "TheMagician",
                "Antes": [1,2,3,4,5,6]
            },
            {
                "type": "SpectralCard",
                "value": "Immolate",
                "Antes": [1,2]
            },
            {
                "type": "Voucher",
                "value": "Blank",
                "Antes": [1,2,3,4,5,6,7,8]
            },
            {
                "type": "PlayingCard",
                "rank": "Ace",
                "suit": "Heart",
                "Antes": [1,2,3,4,5,6]
            },
            {
                "type": "PlayingCard",
                "rank": "Two",
                "suit": "Heart",
                "edition": "Polychrome",
                "enchantment": "Glass",
                "chip": "RedChip",
                "Antes": [1,2,3,4,5,6]
            },
            {
                "type": "Boss",
                "value": "TheNeedle",
                "Antes": [1]
            }
        ],
        "minSearchAnte": 1,
        "maxSearchAnte": 8,
        "deck": "AnaglyphDeck",
        "stake": "BlackStake"
    },
    "$schema": "http://json-schema.org/draft-07/schema#",
    "title": "Ouija Balatro Seed filter config schema",
    "type": "object",
    "properties": {
        "name": { "type": "string" },
        "description": { "type": "string" },
        "author": { "type": "string" },
        "keywords": { "type": "array", "items": { "type": "string" } },
        "filter_config": {
            "type": "object",
            "properties": {
                "numNeeds": { "type": "integer" },
                "numWants": { "type": "integer" },
                "Needs": {
                    "type": "array",
                    "items": { "$ref": "#/definitions/desire" }
                },
                "Wants": {
                    "type": "array",
                    "items": { "$ref": "#/definitions/desire" }
                },
                "minSearchAnte": { "type": "integer" },
                "maxSearchAnte": { "type": "integer" },
                "deck": { "type": "string" },
                "stake": { "type": "string" }
            },
            "required": ["Needs", "Wants"]
        }
    },
    "definitions": {
        "desire": {
            "type": "object",
            "properties": {
                "type": { "type": "string" },
                "value": { "type": "string" },
                "edition": { "type": "string" },
                "jokerStickers": { "type": "array", "items": { "type": "string" } },
                "rank": { "type": "string" },
                "suit": { "type": "string" },
                "enchantment": { "type": "string" },
                "chip": { "type": "string" },
                "desireByAnte": { "type": "integer" },
                "Antes": { "type": "array", "items": { "type": "integer" } },
                "Score": { "type": "integer" },
                "JokerEnum": { "type": "string" },
                "PlanetEnum": { "type": "string" },
                "SpectralEnum": { "type": "string" },
                "TypeEnum": { "type": "string" },
                "VoucherEnum": { "type": "string" },
                "TagEnum": { "type": "string" },
                "TarotEnum": { "type": "string" }
            }
        }
    }
}