{
  "name": "Copilot's Lucky Cat Synergy Hunt",
  "description": "Find OopsAll6s and Ankh in ante 1, TheMagician in ante 2, Lucky Cat in ante 3, and score big for OopsAll6s, Blueprints, and their negatives!",
  "author": "GitHub Copilot",
  "keywords": ["cat", "luck", "magician", "synergy", "combo", "oopsall6s", "ankh", "blueprint"],
  "filter_config": {
    "NumNeeds":1,
    "NumWants": 1,
    "Needs": [
      { "Type": "Tag", "Value": "NegativeTag", "SearchAntes": [2], "Score": 1 },
      { "Type": "Tag", "Value": "NegativeTag", "SearchAntes": [3], "Score": 1 },
      { "Type": "SoulJoker", "Value": "Perkeo", "SearchAntes": [1,2], "Score": 1 }
    ],
    "Wants": [
      { "Type": "Tag", "Value": "NegativeTag", "SearchAntes": [4,5,6,7,8,9,10], "Score": 1 }],
    "MinSearchAnte": 1,
    "MaxSearchAnte": 12,
    "Deck": "RedDeck",
    "Stake": "WhiteStake",
    "ScoreNaturalNegatives": false,
    "ScoreDesiredNegatives": false
  }
}
