{
  "name": "Copilot's Luckiest Cat Hunt",
  "description": "Search for the luckiest cat combo: Lucky Cat, Grim, and a cascade of rare jokers for maximum luck.",
  "author": "GitHub Copilot",
  "keywords": ["cat", "luck", "synergy", "combo", "rare"],
  "filter_config": {
    "NumNeeds": 2,
    "NumWants": 6,
    "Needs": [
      { "Type": "Joker", "Value": "LuckyCat", "SearchAntes": [1], "Score": 1 },
      { "Type": "SpectralCard", "Value": "Grim", "SearchAntes": [2], "Score": 1 }
    ],
    "Wants": [
      { "Type": "Joker", "Value": "Showman", "SearchAntes": [3,4], "Score": 1 },
      { "Type": "Joker", "Value": "OopsAll6s", "SearchAntes": [5], "Score": 1 },
      { "Type": "Joker", "Value": "Blueprint", "SearchAntes": [6], "Score": 1 },
      { "Type": "Joker", "Value": "Bloodstone", "SearchAntes": [7], "Score": 1 },
      { "Type": "SpectralCard", "Value": "Immolate", "SearchAntes": [8], "Score": 1 },
      { "Type": "Joker", "Value": "LuckyCat", "Edition": "Negative", "SearchAntes": [9,10], "Score": 2 }
    ],
    "MinSearchAnte": 1,
    "MaxSearchAnte": 10,
    "Deck": "RedDeck",
    "Stake": "WhiteStake",
    "ScoreNaturalNegatives": false,
    "ScoreDesiredNegatives": false
  }
}
