{
  "name": "Copilot's Glass King of Hearts Red Polychrome Hunt (Fixed)",
  "description": "Find a Glass King of Hearts with Red Seal and Polychrome in ante 1.",
  "author": "GitHub Copilot",
  "keywords": ["glass", "king", "hearts", "redseal", "polychrome", "ante1"],
  "filter_config": {
    "NumNeeds": 1,
    "NumWants": 2,
    "Needs": [
      { "Type": "PlayingCard", "Value": "King", "Rank": "King", "Suit": "Heart", "Edition": "Polychrome", "Seal": "Red", "SearchAntes": [1], "Score": 1 }
    ],
    "Wants": [
      { "Type": "PlayingCard", "Value": "King", "Rank": "King", "Suit": "Heart", "Edition": "Polychrome", "SearchAntes": [1], "Score": 1 },
      { "Type": "PlayingCard", "Value": "King", "Rank": "King", "Suit": "Heart", "Seal": "Red", "SearchAntes": [1], "Score": 1 }
    ],
    "MinSearchAnte": 1,
    "MaxSearchAnte": 1,
    "Deck": "RedDeck",
    "Stake": "WhiteStake",
    "ScoreNaturalNegatives": false,
    "ScoreDesiredNegatives": false
  }
}
