{
  "name": "Copilot's Luckiest Cat + Magician Hunt",
  "description": "Find Lucky Cat after TheMagician Tarot, with Grim and lots of OopsAll6s for max luck!",
  "author": "GitHub Copilot",
  "keywords": ["cat", "luck", "magician", "synergy", "combo", "oopsall6s"],
  "filter_config": {
    "NumNeeds": 3,
    "NumWants": 7,
    "Needs": [
      { "Type": "TarotCard", "Value": "TheMagician", "SearchAntes": [1], "Score": 1 },
      { "Type": "Joker", "Value": "LuckyCat", "SearchAntes": [2], "Score": 1 },
      { "Type": "SpectralCard", "Value": "Grim", "SearchAntes": [3], "Score": 1 }
    ],
    "Wants": [
      { "Type": "Joker", "Value": "OopsAll6s", "SearchAntes": [4,5,6,7,8,9,10], "Score": 2 },
      { "Type": "Joker", "Value": "OopsAll6s", "Edition": "Negative", "SearchAntes": [4,5,6,7,8,9,10], "Score": 5 },
      { "Type": "Joker", "Value": "Showman", "SearchAntes": [4,5], "Score": 1 },
      { "Type": "Joker", "Value": "Blueprint", "SearchAntes": [6], "Score": 1 },
      { "Type": "Joker", "Value": "Bloodstone", "SearchAntes": [7], "Score": 1 },
      { "Type": "SpectralCard", "Value": "Immolate", "SearchAntes": [8], "Score": 1 },
      { "Type": "Joker", "Value": "LuckyCat", "Edition": "Negative", "SearchAntes": [9,10], "Score": 2 }
    ],
    "MinSearchAnte": 1,
    "MaxSearchAnte": 10,
    "Deck": "RedDeck",
    "Stake": "WhiteStake",
    "ScoreNaturalNegatives": false,
    "ScoreDesiredNegatives": false
  }
}
