{
    "name": "test",
    "description": "Very simple test configuration",
    "author": "test",
    "keywords": ["TEST"],
    "filter_config": {
        "numNeeds": 1,
        "numWants": 1,
        "Needs": [
            {
                "type": "Joker",
                "value": "OopsAll6s",
                "edition": "None",
                "searchAntes": [1],
                "Score": 7
            }
        ],
        "Wants": [
            {
                "type": "Joker",
                "value": "OopsAll6s",
                "edition": "None",
                "searchAntes": [1,2,3,4,5,6,7,8],
                "Score": 5
            }
        ],
        "minSearchAnte": 1,
        "maxSearchAnte": 4,
        "deck": "GhostDeck",
        "stake": "WhiteStake",
        "scoreNaturalNegatives": false,
        "scoreDesiredNegatives": false
    }
}