{
  "name": "Test Soul with Charm", 
  "description": "Test searching for Soul with Charm tag",
  "author": "Test",
  "filter_config": {
    "Needs": [
      { "Type": "Tag", "Value": "CharmTag", "SearchAntes": [2] },
      { "Type": "Spectral", "Value": "Soul", "SearchAntes": [1,2,3,4,5,6,7,8] }
    ],
    "Wants": []
  }
}