{
  "name": "pi ouija json config",
  "description": "config to test Editions on a Legendary SoulJoker such as Perkeo",
  "author": "you",
  "keywords": ["HUGE", "ANTE", "TEST"],
  "filter_config": {
    "NumNeeds": 1,
    "NumWants": 5,
    "Needs": [
      {
        "Type": "PlayingCard",
        "Rank": "King",
        "Suit": "Hearts",
        "Enhancement": "Polychrome",
        "Seal": "Red",
        "Edition": "Negative",
        "SearchAntes": [1,2,3,4,5,6,7,8],
        "Score": 1
    }
    ],
    "Wants": [
    ],
    "MinSearchAnte": 1,
    "MaxSearchAnte": 8,
    "Deck": "GhostDeck",
    "Stake": "WhiteStake",
    "ScoreNaturalNegatives": false,
    "ScoreDesiredNegatives": false
  }
}