{
    "name": "test",
    "description": "Very simple test configuration",
    "author": "test",
    "keywords": ["TEST"],
    "filter_config": {
        "numNeeds": 1,
        "numWants": 1,
        "Needs": [
            {
                "type": "Joker",
                "value": "HangingChad",
                "edition": "None",
                "searchAntes": [1,2],
                "Score": 1
            }
        ],
        "Wants": [
            {
                "type": "Joker",
                "value": "HangingChad",
                "edition": "None",
                "searchAntes": [1,2],
                "Score": 1
            }
        ],
        "minSearchAnte": 1,
        "maxSearchAnte": 2,
        "deck": "GhostDeck",
        "stake": "WhiteStake",
        "scoreNaturalNegatives": true,
        "scoreDesiredNegatives": true
    }
}