{
    "name": "debug_test",
    "description": "Debug test - only wants, common jokers",
    "author": "test",
    "keywords": ["TEST", "DEBUG"],
    "filter_config": {
        "numNeeds": 0,
        "numWants": 1,
        "Needs": [],
        "Wants": [
            {
                "type": "Joker",
                "value": "Joker",
                "edition": "None",
                "searchAntes": [1],
                "desireByAnte": 1,
                "Score": 1
            }
        ],
        "minSearchAnte": 1,
        "maxSearchAnte": 1,
        "deck": "RedDeck",
        "stake": "WhiteStake",
        "scoreNaturalNegatives": false,
        "scoreDesiredNegatives": false
    }
}